{"schema_version":1,"mode":"demo","generated_utc":"2026-10-19T12:00:00Z","as_of_utc":"2026-10-19T12:00:00Z","source":"demo-generator","symbol":"GBPJPY","timeframe":"M15","candles":[{"t":1792119600,"o":191.691,"h":191.861,"l":191.666,"c":191.831,"v":1499},{"t":1792120500,"o":191.831,"h":191.933,"l":191.776,"c":191.776,"v":1469},{"t":1792121400,"o":191.776,"h":191.918,"l":191.72,"c":191.874,"v":1284},{"t":1792122300,"o":191.874,"h":191.9,"l":191.796,"c":191.849,"v":1189},{"t":1792123200,"o":191.849,"h":191.92,"l":191.807,"c":191.895,"v":967},{"t":1792124100,"o":191.895,"h":191.916,"l":191.87,"c":191.899,"v":814},{"t":1792125000,"o":191.899,"h":191.92,"l":191.858,"c":191.88,"v":753},{"t":1792125900,"o":191.88,"h":191.901,"l":191.862,"c":191.876,"v":646},{"t":1792126800,"o":191.876,"h":191.943,"l":191.862,"c":191.911,"v":824},{"t":1792127700,"o":191.911,"h":192.029,"l":191.89,"c":192.001,"v":777},{"t":1792128600,"o":192.001,"h":192.074,"l":191.998,"c":192.029,"v":722},{"t":1792129500,"o":192.029,"h":192.061,"l":192.007,"c":192.058,"v":745},{"t":1792130400,"o":192.058,"h":192.066,"l":191.965,"c":192.04,"v":1124},{"t":1792131300,"o":192.04,"h":192.086,"l":191.969,"c":192.018,"v":990},{"t":1792132200,"o":192.018,"h":192.075,"l":192.011,"c":192.046,"v":1042},{"t":1792133100,"o":192.046,"h":192.107,"l":191.997,"c":192.071,"v":1048},{"t":1792134000,"o":192.071,"h":192.22,"l":191.974,"c":192.216,"v":1880},{"t":1792134900,"o":192.216,"h":192.374,"l":192.157,"c":192.337,"v":1821},{"t":1792135800,"o":192.337,"h":192.411,"l":192.226,"c":192.354,"v":1755},{"t":1792136700,"o":192.354,"h":192.481,"l":192.269,"c":192.448,"v":1644},{"t":1792137600,"o":192.448,"h":192.513,"l":192.406,"c":192.431,"v":1724},{"t":1792138500,"o":192.431,"h":192.481,"l":192.311,"c":192.366,"v":1570},{"t":1792139400,"o":192.366,"h":192.39,"l":192.167,"c":192.192,"v":1433},{"t":1792140300,"o":192.192,"h":192.274,"l":192.146,"c":192.155,"v":1588},{"t":1792141200,"o":192.155,"h":192.232,"l":192.103,"c":192.223,"v":1314},{"t":1792142100,"o":192.223,"h":192.33,"l":192.172,"c":192.208,"v":1351},{"t":1792143000,"o":192.208,"h":192.328,"l":192.191,"c":192.27,"v":1504},{"t":1792143900,"o":192.27,"h":192.43,"l":192.266,"c":192.406,"v":1266},{"t":1792144800,"o":192.406,"h":192.463,"l":192.321,"c":192.357,"v":1633},{"t":1792145700,"o":192.357,"h":192.516,"l":192.298,"c":192.484,"v":1906},{"t":1792146600,"o":192.484,"h":192.548,"l":192.374,"c":192.418,"v":1810},{"t":1792147500,"o":192.418,"h":192.531,"l":192.403,"c":192.508,"v":1601},{"t":1792148400,"o":192.508,"h":192.556,"l":192.389,"c":192.424,"v":1418},{"t":1792149300,"o":192.424,"h":192.426,"l":192.261,"c":192.308,"v":1374},{"t":1792150200,"o":192.308,"h":192.399,"l":192.263,"c":192.285,"v":1234},{"t":1792151100,"o":192.285,"h":192.338,"l":192.157,"c":192.314,"v":1488},{"t":1792152000,"o":192.314,"h":192.393,"l":192.247,"c":192.333,"v":1777},{"t":1792152900,"o":192.333,"h":192.348,"l":192.237,"c":192.332,"v":1511},{"t":1792153800,"o":192.332,"h":192.36,"l":192.197,"c":192.237,"v":1972},{"t":1792154700,"o":192.237,"h":192.338,"l":192.113,"c":192.292,"v":2133},{"t":1792155600,"o":192.292,"h":192.467,"l":192.253,"c":192.447,"v":1773},{"t":1792156500,"o":192.447,"h":192.546,"l":192.384,"c":192.513,"v":1882},{"t":1792157400,"o":192.513,"h":192.54,"l":192.328,"c":192.387,"v":1965},{"t":1792158300,"o":192.387,"h":192.565,"l":192.378,"c":192.44,"v":1898},{"t":1792159200,"o":192.44,"h":192.47,"l":192.308,"c":192.404,"v":1807},{"t":1792160100,"o":192.404,"h":192.459,"l":192.236,"c":192.263,"v":1938},{"t":1792161000,"o":192.263,"h":192.567,"l":192.228,"c":192.544,"v":1801},{"t":1792161900,"o":192.544,"h":192.583,"l":192.401,"c":192.513,"v":1896},{"t":1792162800,"o":192.513,"h":192.533,"l":192.27,"c":192.271,"v":2035},{"t":1792163700,"o":192.271,"h":192.506,"l":192.252,"c":192.359,"v":2295},{"t":1792164600,"o":192.359,"h":192.527,"l":192.346,"c":192.472,"v":2135},{"t":1792165500,"o":192.472,"h":192.601,"l":192.427,"c":192.455,"v":2340},{"t":1792166400,"o":192.455,"h":192.529,"l":192.395,"c":192.527,"v":1288},{"t":1792167300,"o":192.527,"h":192.573,"l":192.456,"c":192.458,"v":1232},{"t":1792168200,"o":192.458,"h":192.52,"l":192.412,"c":192.458,"v":1193},{"t":1792169100,"o":192.458,"h":192.474,"l":192.371,"c":192.397,"v":985},{"t":1792170000,"o":192.397,"h":192.512,"l":192.378,"c":192.44,"v":1123},{"t":1792170900,"o":192.44,"h":192.49,"l":192.409,"c":192.429,"v":1047},{"t":1792171800,"o":192.429,"h":192.459,"l":192.341,"c":192.344,"v":1056},{"t":1792172700,"o":192.344,"h":192.354,"l":192.299,"c":192.308,"v":923},{"t":1792173600,"o":192.308,"h":192.337,"l":192.191,"c":192.194,"v":1214},{"t":1792174500,"o":192.194,"h":192.287,"l":192.156,"c":192.275,"v":1166},{"t":1792175400,"o":192.275,"h":192.318,"l":192.11,"c":192.123,"v":1409},{"t":1792176300,"o":192.123,"h":192.241,"l":192.109,"c":192.144,"v":1803},{"t":1792177200,"o":192.144,"h":192.165,"l":191.892,"c":192.027,"v":1375},{"t":1792178100,"o":192.027,"h":192.044,"l":191.816,"c":191.876,"v":1628},{"t":1792179000,"o":191.876,"h":191.938,"l":191.775,"c":191.858,"v":1245},{"t":1792179900,"o":191.858,"h":191.873,"l":191.743,"c":191.769,"v":1322},{"t":1792180800,"o":191.769,"h":191.869,"l":191.73,"c":191.826,"v":1368},{"t":1792181700,"o":191.826,"h":192.023,"l":191.793,"c":191.995,"v":1159},{"t":1792182600,"o":191.995,"h":192.13,"l":191.923,"c":192.095,"v":1390},{"t":1792183500,"o":192.095,"h":192.144,"l":191.992,"c":192.036,"v":1483},{"t":1792368000,"o":192.036,"h":192.058,"l":191.961,"c":191.967,"v":1016},{"t":1792368900,"o":191.967,"h":191.981,"l":191.907,"c":191.91,"v":1061},{"t":1792369800,"o":191.91,"h":192.024,"l":191.891,"c":192.001,"v":1121},{"t":1792370700,"o":192.001,"h":192.048,"l":191.943,"c":192.038,"v":1397},{"t":1792371600,"o":192.038,"h":192.097,"l":191.967,"c":192.016,"v":1146},{"t":1792372500,"o":192.016,"h":192.051,"l":191.917,"c":191.999,"v":1275},{"t":1792373400,"o":191.999,"h":192.091,"l":191.925,"c":191.964,"v":1395},{"t":1792374300,"o":191.964,"h":192.123,"l":191.922,"c":192.033,"v":1450},{"t":1792375200,"o":192.033,"h":192.156,"l":192.008,"c":192.151,"v":1289},{"t":1792376100,"o":192.151,"h":192.234,"l":192.138,"c":192.191,"v":1135},{"t":1792377000,"o":192.191,"h":192.268,"l":192.184,"c":192.257,"v":873},{"t":1792377900,"o":192.257,"h":192.305,"l":192.235,"c":192.25,"v":892},{"t":1792378800,"o":192.25,"h":192.338,"l":192.235,"c":192.29,"v":783},{"t":1792379700,"o":192.29,"h":192.333,"l":192.262,"c":192.297,"v":907},{"t":1792380600,"o":192.297,"h":192.38,"l":192.259,"c":192.362,"v":1291},{"t":1792381500,"o":192.362,"h":192.483,"l":192.29,"c":192.403,"v":1241},{"t":1792382400,"o":192.403,"h":192.544,"l":192.374,"c":192.538,"v":780},{"t":1792383300,"o":192.538,"h":192.565,"l":192.491,"c":192.538,"v":882},{"t":1792384200,"o":192.538,"h":192.561,"l":192.485,"c":192.557,"v":1004},{"t":1792385100,"o":192.557,"h":192.643,"l":192.514,"c":192.559,"v":1347},{"t":1792386000,"o":192.559,"h":192.719,"l":192.513,"c":192.613,"v":1318},{"t":1792386900,"o":192.613,"h":192.672,"l":192.562,"c":192.627,"v":1122},{"t":1792387800,"o":192.627,"h":192.738,"l":192.567,"c":192.732,"v":970},{"t":1792388700,"o":192.732,"h":192.866,"l":192.717,"c":192.847,"v":1184},{"t":1792389600,"o":192.847,"h":192.921,"l":192.707,"c":192.901,"v":1598},{"t":1792390500,"o":192.901,"h":192.942,"l":192.85,"c":192.879,"v":1315},{"t":1792391400,"o":192.879,"h":192.979,"l":192.85,"c":192.932,"v":1273},{"t":1792392300,"o":192.932,"h":193.013,"l":192.883,"c":192.999,"v":1148},{"t":1792393200,"o":192.999,"h":193.027,"l":192.827,"c":192.96,"v":1962},{"t":1792394100,"o":192.96,"h":192.974,"l":192.809,"c":192.818,"v":1760},{"t":1792395000,"o":192.818,"h":192.992,"l":192.789,"c":192.901,"v":1338},{"t":1792395900,"o":192.901,"h":192.915,"l":192.736,"c":192.848,"v":1557},{"t":1792396800,"o":192.848,"h":192.862,"l":192.656,"c":192.75,"v":2374},{"t":1792397700,"o":192.75,"h":193.067,"l":192.701,"c":192.88,"v":2512},{"t":1792398600,"o":192.88,"h":193.212,"l":192.777,"c":193.21,"v":3085},{"t":1792399500,"o":193.21,"h":193.224,"l":193.045,"c":193.076,"v":2396},{"t":1792400400,"o":193.076,"h":193.338,"l":193.034,"c":193.319,"v":1545},{"t":1792401300,"o":193.319,"h":193.49,"l":193.304,"c":193.489,"v":1978},{"t":1792402200,"o":193.489,"h":193.675,"l":193.477,"c":193.654,"v":1815},{"t":1792403100,"o":193.654,"h":193.692,"l":193.547,"c":193.654,"v":1623},{"t":1792404000,"o":193.654,"h":193.78,"l":193.603,"c":193.757,"v":1275},{"t":1792404900,"o":193.757,"h":193.821,"l":193.714,"c":193.811,"v":1117},{"t":1792405800,"o":193.811,"h":193.928,"l":193.742,"c":193.926,"v":1391},{"t":1792406700,"o":193.926,"h":193.946,"l":193.861,"c":193.873,"v":1625},{"t":1792407600,"o":193.873,"h":193.942,"l":193.722,"c":193.835,"v":1882},{"t":1792408500,"o":193.835,"h":193.854,"l":193.734,"c":193.798,"v":1812},{"t":1792409400,"o":193.798,"h":193.82,"l":193.57,"c":193.696,"v":1643},{"t":1792410300,"o":193.696,"h":193.744,"l":193.608,"c":193.66,"v":1718}]}
