{"schema_version":1,"mode":"demo","generated_utc":"2026-10-19T12:00:00Z","as_of_utc":"2026-10-19T12:00:00Z","source":"demo-generator","symbol":"XAUUSD","timeframe":"M15","candles":[{"t":1792119600,"o":4184.53,"h":4186.24,"l":4182.55,"c":4183.52,"v":803},{"t":1792120500,"o":4183.52,"h":4188.29,"l":4180.9,"c":4187.47,"v":759},{"t":1792121400,"o":4187.47,"h":4190.21,"l":4185.53,"c":4188.51,"v":909},{"t":1792122300,"o":4188.51,"h":4195.74,"l":4187.84,"c":4195.2,"v":919},{"t":1792123200,"o":4195.2,"h":4199.04,"l":4192.76,"c":4198.12,"v":973},{"t":1792124100,"o":4198.12,"h":4200.26,"l":4193.76,"c":4197.63,"v":1120},{"t":1792125000,"o":4197.63,"h":4201.6,"l":4194.86,"c":4196.89,"v":1048},{"t":1792125900,"o":4196.89,"h":4199.86,"l":4194.54,"c":4197.83,"v":1118},{"t":1792126800,"o":4197.83,"h":4203.5,"l":4194.99,"c":4195.2,"v":1081},{"t":1792127700,"o":4195.2,"h":4203.34,"l":4195.05,"c":4202.85,"v":1083},{"t":1792128600,"o":4202.85,"h":4211.09,"l":4201.91,"c":4207.33,"v":1244},{"t":1792129500,"o":4207.33,"h":4209.01,"l":4203.46,"c":4205.22,"v":1072},{"t":1792130400,"o":4205.22,"h":4207.48,"l":4202.05,"c":4205.33,"v":975},{"t":1792131300,"o":4205.33,"h":4206.16,"l":4200.86,"c":4202.12,"v":945},{"t":1792132200,"o":4202.12,"h":4204.15,"l":4196.82,"c":4198.94,"v":850},{"t":1792133100,"o":4198.94,"h":4205.35,"l":4196.27,"c":4201.56,"v":1202},{"t":1792134000,"o":4201.56,"h":4204.41,"l":4179.96,"c":4186.18,"v":2257},{"t":1792134900,"o":4186.18,"h":4196.78,"l":4179.32,"c":4191.96,"v":1948},{"t":1792135800,"o":4191.96,"h":4216.4,"l":4190.81,"c":4214.38,"v":1790},{"t":1792136700,"o":4214.38,"h":4231.08,"l":4211.07,"c":4220.33,"v":2780},{"t":1792137600,"o":4220.33,"h":4227.08,"l":4208.7,"c":4212.09,"v":2657},{"t":1792138500,"o":4212.09,"h":4224.61,"l":4206.87,"c":4222.57,"v":2426},{"t":1792139400,"o":4222.57,"h":4224.49,"l":4211.35,"c":4213.51,"v":2377},{"t":1792140300,"o":4213.51,"h":4216.81,"l":4200.53,"c":4207.48,"v":2773},{"t":1792141200,"o":4207.48,"h":4210.94,"l":4201.8,"c":4205.19,"v":1832},{"t":1792142100,"o":4205.19,"h":4210.43,"l":4200.77,"c":4207.24,"v":1866},{"t":1792143000,"o":4207.24,"h":4207.99,"l":4199.78,"c":4202.3,"v":1647},{"t":1792143900,"o":4202.3,"h":4215.18,"l":4197.79,"c":4213.48,"v":1850},{"t":1792144800,"o":4213.48,"h":4215.77,"l":4198.77,"c":4207.62,"v":1929},{"t":1792145700,"o":4207.62,"h":4215.98,"l":4203.99,"c":4212.94,"v":1615},{"t":1792146600,"o":4212.94,"h":4212.97,"l":4199.87,"c":4202,"v":1498},{"t":1792147500,"o":4202,"h":4212.24,"l":4199.73,"c":4205.21,"v":1675},{"t":1792148400,"o":4205.21,"h":4205.46,"l":4195.6,"c":4201.19,"v":1764},{"t":1792149300,"o":4201.19,"h":4204.97,"l":4187.71,"c":4187.92,"v":1980},{"t":1792150200,"o":4187.92,"h":4194.1,"l":4180.45,"c":4183.12,"v":2438},{"t":1792151100,"o":4183.12,"h":4186.51,"l":4165.59,"c":4167.88,"v":2712},{"t":1792152000,"o":4167.88,"h":4174.92,"l":4145.18,"c":4147.05,"v":3124},{"t":1792152900,"o":4147.05,"h":4148.64,"l":4138.3,"c":4143.07,"v":2554},{"t":1792153800,"o":4143.07,"h":4143.12,"l":4121.73,"c":4133.67,"v":2651},{"t":1792154700,"o":4133.67,"h":4141.76,"l":4127.91,"c":4131.09,"v":2815},{"t":1792155600,"o":4131.09,"h":4139.29,"l":4117.62,"c":4120.53,"v":2539},{"t":1792156500,"o":4120.53,"h":4127.48,"l":4116.65,"c":4117.66,"v":2189},{"t":1792157400,"o":4117.66,"h":4118.54,"l":4097.48,"c":4099.61,"v":2188},{"t":1792158300,"o":4099.61,"h":4100.13,"l":4087.42,"c":4094.57,"v":2445},{"t":1792159200,"o":4094.57,"h":4096.69,"l":4084.09,"c":4095.42,"v":2521},{"t":1792160100,"o":4095.42,"h":4107.8,"l":4094.73,"c":4102.87,"v":2358},{"t":1792161000,"o":4102.87,"h":4108.67,"l":4100.05,"c":4106.69,"v":2100},{"t":1792161900,"o":4106.69,"h":4109.27,"l":4100.3,"c":4104.81,"v":1850},{"t":1792162800,"o":4104.81,"h":4105.22,"l":4095.78,"c":4099.25,"v":1631},{"t":1792163700,"o":4099.25,"h":4101.73,"l":4091.38,"c":4095.91,"v":2612},{"t":1792164600,"o":4095.91,"h":4098.77,"l":4082.6,"c":4088.11,"v":2685},{"t":1792165500,"o":4088.11,"h":4095.22,"l":4081.55,"c":4090.18,"v":2266},{"t":1792166400,"o":4090.18,"h":4091.97,"l":4082.73,"c":4084.97,"v":1336},{"t":1792167300,"o":4084.97,"h":4085.53,"l":4080.63,"c":4084.38,"v":1142},{"t":1792168200,"o":4084.38,"h":4085.93,"l":4074.66,"c":4079.46,"v":1022},{"t":1792169100,"o":4079.46,"h":4080.57,"l":4075.3,"c":4076.16,"v":1228},{"t":1792170000,"o":4076.16,"h":4083.61,"l":4074.79,"c":4079.89,"v":1309},{"t":1792170900,"o":4079.89,"h":4082.93,"l":4076.93,"c":4078.55,"v":1353},{"t":1792171800,"o":4078.55,"h":4079.84,"l":4070.95,"c":4073.89,"v":1210},{"t":1792172700,"o":4073.89,"h":4074.92,"l":4066.08,"c":4071.1,"v":1334},{"t":1792173600,"o":4071.1,"h":4071.32,"l":4060,"c":4062.77,"v":1432},{"t":1792174500,"o":4062.77,"h":4064.13,"l":4054.72,"c":4055.12,"v":1215},{"t":1792175400,"o":4055.12,"h":4060.5,"l":4054.03,"c":4058.43,"v":1330},{"t":1792176300,"o":4058.43,"h":4061.62,"l":4054.13,"c":4060.62,"v":1115},{"t":1792177200,"o":4060.62,"h":4062.42,"l":4053.97,"c":4055.93,"v":977},{"t":1792178100,"o":4055.93,"h":4061.27,"l":4054.53,"c":4058.81,"v":1224},{"t":1792179000,"o":4058.81,"h":4060.96,"l":4052.82,"c":4054.05,"v":1292},{"t":1792179900,"o":4054.05,"h":4054.46,"l":4047.47,"c":4049.22,"v":1356},{"t":1792180800,"o":4049.22,"h":4051.61,"l":4043.87,"c":4046.4,"v":1447},{"t":1792181700,"o":4046.4,"h":4052.33,"l":4043.95,"c":4044.71,"v":1254},{"t":1792182600,"o":4044.71,"h":4048.35,"l":4038.43,"c":4043.78,"v":1354},{"t":1792183500,"o":4043.78,"h":4046,"l":4024.64,"c":4024.75,"v":1758},{"t":1792368000,"o":4024.75,"h":4026.56,"l":4017.72,"c":4020.99,"v":1078},{"t":1792368900,"o":4020.99,"h":4021.91,"l":4015.72,"c":4016.45,"v":1049},{"t":1792369800,"o":4016.45,"h":4025.21,"l":4014.15,"c":4022.39,"v":1119},{"t":1792370700,"o":4022.39,"h":4027.15,"l":4020.83,"c":4026.42,"v":1246},{"t":1792371600,"o":4026.42,"h":4033.54,"l":4023.77,"c":4032.63,"v":1118},{"t":1792372500,"o":4032.63,"h":4037.22,"l":4032.31,"c":4035.82,"v":900},{"t":1792373400,"o":4035.82,"h":4035.99,"l":4029.63,"c":4033.84,"v":779},{"t":1792374300,"o":4033.84,"h":4035.03,"l":4030.37,"c":4031.4,"v":729},{"t":1792375200,"o":4031.4,"h":4032.74,"l":4028.17,"c":4028.42,"v":809},{"t":1792376100,"o":4028.42,"h":4029.06,"l":4025.22,"c":4026.72,"v":686},{"t":1792377000,"o":4026.72,"h":4030.1,"l":4025.87,"c":4027.06,"v":758},{"t":1792377900,"o":4027.06,"h":4029.83,"l":4025.32,"c":4027.92,"v":1182},{"t":1792378800,"o":4027.92,"h":4035.93,"l":4024.1,"c":4034.14,"v":1269},{"t":1792379700,"o":4034.14,"h":4038.42,"l":4031.31,"c":4033.47,"v":1499},{"t":1792380600,"o":4033.47,"h":4039.52,"l":4031.73,"c":4035.13,"v":1328},{"t":1792381500,"o":4035.13,"h":4042.26,"l":4032.5,"c":4035.51,"v":1519},{"t":1792382400,"o":4035.51,"h":4041.51,"l":4032.98,"c":4033.99,"v":1106},{"t":1792383300,"o":4033.99,"h":4036.34,"l":4027.97,"c":4029.33,"v":1223},{"t":1792384200,"o":4029.33,"h":4032.36,"l":4024.46,"c":4027.96,"v":1179},{"t":1792385100,"o":4027.96,"h":4034.51,"l":4026.44,"c":4031.59,"v":1116},{"t":1792386000,"o":4031.59,"h":4032.67,"l":4022.32,"c":4022.63,"v":974},{"t":1792386900,"o":4022.63,"h":4030.71,"l":4022.14,"c":4028,"v":887},{"t":1792387800,"o":4028,"h":4030.59,"l":4026.86,"c":4029.94,"v":737},{"t":1792388700,"o":4029.94,"h":4032.36,"l":4029.07,"c":4030.59,"v":690},{"t":1792389600,"o":4030.59,"h":4033.29,"l":4029.11,"c":4032.83,"v":684},{"t":1792390500,"o":4032.83,"h":4033.16,"l":4026.99,"c":4028.24,"v":676},{"t":1792391400,"o":4028.24,"h":4029.04,"l":4022.24,"c":4024.67,"v":851},{"t":1792392300,"o":4024.67,"h":4027.63,"l":4023.55,"c":4026.36,"v":897},{"t":1792393200,"o":4026.36,"h":4027.24,"l":4015.04,"c":4021.98,"v":2158},{"t":1792394100,"o":4021.98,"h":4026.8,"l":4017.05,"c":4020.7,"v":2126},{"t":1792395000,"o":4020.7,"h":4026.72,"l":4011.24,"c":4013.59,"v":2092},{"t":1792395900,"o":4013.59,"h":4027.6,"l":4013.06,"c":4027.23,"v":1875},{"t":1792396800,"o":4027.23,"h":4036.16,"l":4021.86,"c":4023.82,"v":1738},{"t":1792397700,"o":4023.82,"h":4031.35,"l":4022.69,"c":4028.4,"v":1572},{"t":1792398600,"o":4028.4,"h":4037.09,"l":4026.03,"c":4035.76,"v":2234},{"t":1792399500,"o":4035.76,"h":4046.09,"l":4034.28,"c":4040.88,"v":2225},{"t":1792400400,"o":4040.88,"h":4049.39,"l":4040.39,"c":4046.29,"v":1653},{"t":1792401300,"o":4046.29,"h":4053.82,"l":4046.03,"c":4048.08,"v":1671},{"t":1792402200,"o":4048.08,"h":4051.55,"l":4043.17,"c":4044.36,"v":1514},{"t":1792403100,"o":4044.36,"h":4050.84,"l":4042.71,"c":4048.44,"v":1515},{"t":1792404000,"o":4048.44,"h":4054.13,"l":4045.49,"c":4045.67,"v":1450},{"t":1792404900,"o":4045.67,"h":4048.05,"l":4040.13,"c":4040.82,"v":1485},{"t":1792405800,"o":4040.82,"h":4049.2,"l":4038.5,"c":4039.2,"v":1446},{"t":1792406700,"o":4039.2,"h":4043.68,"l":4038.21,"c":4040.88,"v":1345},{"t":1792407600,"o":4040.88,"h":4041.73,"l":4035.46,"c":4038.41,"v":1231},{"t":1792408500,"o":4038.41,"h":4041.68,"l":4033.69,"c":4034.12,"v":1239},{"t":1792409400,"o":4034.12,"h":4040.77,"l":4031.95,"c":4038.82,"v":1545},{"t":1792410300,"o":4038.82,"h":4042.86,"l":4036.28,"c":4038.22,"v":1338}]}
